{"iteration": 1, "case_id": "2", "analysis": {"root_cause": "The agent failed to accurately project the trajectory line from the ball's current position and angle to the corresponding pocket.", "next_action": "generate_tool"}, "tool_generated": "billiards_trajectory_projector", "skill_generated": "billiards", "validation_input_image": "datasets/mira/billiards/images/2.png", "validation_chain_trace": [], "decision": "discard"}
{"iteration": 2, "case_id": "2", "analysis": {"root_cause": "The existing tool 'billiards_trajectory_projector' is hallucinating a trajectory line that ignores the actual vector indicated by the green arrow in the input image.", "next_action": "generate_tool"}, "tool_generated": "billiards_geometric_projector", "skill_generated": "billiards", "validation_input_image": "datasets/mira/billiards/images/2.png", "validation_chain_trace": [], "decision": "discard"}
{"type": "promotion", "cap_type": "tool", "name": "billiards_full_path_projector", "decision": "keep", "timestamp": "2026-03-15T16:32:03.659959"}
{"type": "promotion", "cap_type": "skill", "name": "billiards", "decision": "keep", "timestamp": "2026-03-15T16:32:03.661587"}
{"iteration": 3, "case_id": "2", "analysis": {"root_cause": "The current tool only draws a partial line segment instead of calculating the full reflection path off the cushions to the correct pocket.", "next_action": "generate_tool"}, "tool_generated": "billiards_full_path_projector", "skill_generated": "billiards", "validation_input_image": "datasets/mira/billiards/images/2.png", "validation_chain_trace": [], "decision": "keep"}
{"case_id": "2", "solve_success": true, "attempts": 3}
{"type": "promotion", "cap_type": "tool", "name": "billiards_reflection_calculator", "decision": "keep", "timestamp": "2026-03-15T16:33:57.187473"}
{"type": "promotion", "cap_type": "skill", "name": "billiards", "decision": "keep", "timestamp": "2026-03-15T16:33:57.188737"}
{"iteration": 1, "case_id": "11", "analysis": {"root_cause": "The current tool `billiards_full_path_projector` is producing geometrically incorrect reflection paths, leading to wrong predictions.", "next_action": "generate_tool"}, "tool_generated": "billiards_reflection_calculator", "skill_generated": "billiards", "validation_input_image": "artifacts/case_11/attempt_1/chain_1_billiards_full_path_projector/billiards_full_path_output.png", "validation_chain_trace": ["billiards_full_path_projector"], "decision": "keep"}
{"case_id": "11", "solve_success": true, "attempts": 1}
