{"type": "promotion", "cap_type": "tool", "name": "mirror_flip_tool", "decision": "keep", "timestamp": "2026-03-15T04:19:20.898910"}
{"type": "promotion", "cap_type": "skill", "name": "mirror_clock", "decision": "keep", "timestamp": "2026-03-15T04:19:20.900660"}
{"iteration": 1, "case_id": "2", "analysis": {"root_cause": "The agent failed to perform the horizontal reflection (mirroring) required to interpret the clock face correctly before calculating the time.", "next_action": "generate_tool"}, "tool_generated": "mirror_flip_tool", "skill_generated": "mirror_clock", "validation_input_image": "datasets/mira/images/2.png", "validation_chain_trace": [], "decision": "keep"}
{"case_id": "2", "solve_success": true, "attempts": 1}
{"iteration": 1, "case_id": "18", "analysis": {"root_cause": "The agent misread the time from the corrected clock face (read 7:10 instead of 7:50) and performed incorrect arithmetic.", "next_action": "generate_skill"}, "tool_generated": null, "skill_generated": "mirror_clock", "validation_input_image": null, "validation_chain_trace": [], "decision": "discard"}
{"iteration": 2, "case_id": "18", "analysis": {"root_cause": "The mirror_flip_tool only performs a horizontal flip, failing to correct the vertical inversion (upside-down orientation) of the clock face.", "next_action": "generate_both"}, "tool_generated": "rotate_180_tool", "skill_generated": "mirror_clock", "validation_input_image": "artifacts/mirror_flip_output.png", "validation_chain_trace": ["mirror_flip_tool"], "decision": "discard"}
{"iteration": 3, "case_id": "18", "analysis": {"root_cause": "The agent is struggling to interpret the mirrored clock face correctly after the flip, often misreading the hand positions due to the unconventional layout of the numbers.", "next_action": "generate_skill"}, "tool_generated": null, "skill_generated": "mirror_clock", "validation_input_image": null, "validation_chain_trace": [], "decision": "discard"}
