{"iteration": 1, "case_id": "2", "analysis": {"root_cause": "The agent failed to perform a geometric trajectory simulation (reflection calculation) based on the arrow's vector.", "next_action": "generate_tool"}, "tool_generated": "billiards_trajectory", "skill_generated": "billiards", "validation_input_image": "datasets/mira/billiards/images/2.png", "validation_chain_trace": [], "decision": "discard"}
{"type": "promotion", "cap_type": "tool", "name": "billiards_trajectory_precise", "decision": "keep", "timestamp": "2026-03-15T18:29:12.787648"}
{"type": "promotion", "cap_type": "skill", "name": "billiards", "decision": "keep", "timestamp": "2026-03-15T18:29:12.787989"}
{"iteration": 2, "case_id": "2", "analysis": {"root_cause": "The trajectory tool is failing to correctly identify the starting position of the ball and the initial vector of the green arrow, resulting in a hallucinated path.", "next_action": "generate_tool"}, "tool_generated": "billiards_trajectory_precise", "skill_generated": "billiards", "validation_input_image": "datasets/mira/billiards/images/2.png", "validation_chain_trace": [], "decision": "keep"}
{"case_id": "2", "solve_success": true, "attempts": 2}
{"iteration": 1, "case_id": "11", "analysis": {"root_cause": "The tool `billiards_trajectory_precise` failed to correctly identify the ball's position and the arrow's orientation, resulting in hallucinated trajectory visualizations.", "next_action": "generate_tool"}, "tool_generated": "billiards_geometry_extractor", "skill_generated": "billiards", "validation_input_image": "artifacts/problem_billiards/case_11/attempt_1/chain_1_billiards_trajectory_precise/trajectory_debug.png", "validation_chain_trace": ["billiards_trajectory_precise"], "decision": "discard"}
{"type": "promotion", "cap_type": "tool", "name": "billiards_geometry_solver", "decision": "keep", "timestamp": "2026-03-15T18:32:15.859246"}
{"type": "promotion", "cap_type": "skill", "name": "billiards", "decision": "keep", "timestamp": "2026-03-15T18:32:15.860550"}
{"iteration": 2, "case_id": "11", "analysis": {"root_cause": "The existing trajectory tool is failing to correctly identify the ball's starting position and the arrow's vector, leading to erroneous visual debugging artifacts.", "next_action": "generate_tool"}, "tool_generated": "billiards_geometry_solver", "skill_generated": "billiards", "validation_input_image": "artifacts/problem_billiards/case_11/attempt_2/chain_1_billiards_trajectory_precise/trajectory_debug.png", "validation_chain_trace": ["billiards_trajectory_precise"], "decision": "keep"}
{"case_id": "11", "solve_success": true, "attempts": 2}
