{"type": "promotion", "cap_type": "tool", "name": "mirror_flip", "decision": "keep", "timestamp": "2026-03-15T03:19:29.013517"}
{"type": "promotion", "cap_type": "skill", "name": "mirror_clock", "decision": "keep", "timestamp": "2026-03-15T03:19:29.013907"}
{"iteration": 1, "case_id": "2", "analysis": {"root_cause": "The agent failed to perform the horizontal flip transformation to read the clock correctly and then failed to perform the temporal calculation.", "next_action": "generate_both"}, "tool_generated": "mirror_flip", "skill_generated": "mirror_clock", "decision": "keep"}
{"case_id": "2", "solve_success": true, "attempts": 1}
{"iteration": 1, "case_id": "18", "analysis": {"root_cause": "The agent misread the flipped clock as 7:10 (it is actually 7:10, but the math was performed incorrectly: 7:10 + 9h 35m = 16:45, which is 4:45, but the agent failed to correctly interpret the mirror clock's time or perform the addition correctly). Wait, 7:10 + 9h 35m is 16:45 (4:45). The expected answer is 1:40. The agent misread the clock: the hour hand is between 7 and 8, minute hand is at 2 (10 mins). Actually, the flipped clock shows 4:05. The agent is hallucinating the time.", "next_action": "generate_skill"}, "tool_generated": null, "skill_generated": "mirror_clock", "decision": "discard"}
{"iteration": 2, "case_id": "18", "analysis": {"root_cause": "The agent misread the flipped clock as 7:10 instead of 7:50 (or 8:10 depending on hand position), leading to incorrect arithmetic.", "next_action": "generate_skill"}, "tool_generated": null, "skill_generated": "mirror_clock", "decision": "discard"}
{"iteration": 3, "case_id": "18", "analysis": {"root_cause": "The agent misread the flipped clock face. In the artifact, the hour hand is clearly pointing between 4 and 5, and the minute hand is at 2 (10 minutes), making the time 4:10, not 7:10.", "next_action": "generate_skill"}, "tool_generated": null, "skill_generated": "mirror_clock", "decision": "discard"}
