{"iteration": 1, "case_id": "2", "analysis": {"root_cause": "The agent failed to perform the horizontal flip transformation required to read the mirrored clock correctly and did not calculate the time offset.", "next_action": "generate_both"}, "tool_generated": "mirror_clock_corrector", "skill_generated": "mirror_clock", "decision": "discard"}
{"type": "promotion", "cap_type": "tool", "name": "mirror_clock_transformer", "decision": "keep", "timestamp": "2026-03-15T03:28:47.820593"}
{"type": "promotion", "cap_type": "skill", "name": "mirror_clock", "decision": "keep", "timestamp": "2026-03-15T03:28:47.821174"}
{"iteration": 2, "case_id": "2", "analysis": {"root_cause": "The tool failed to actually transform the image (it returned the input unchanged), and the agent lacks the logic to perform the mirror-to-standard time conversion.", "next_action": "generate_both"}, "tool_generated": "mirror_clock_transformer", "skill_generated": "mirror_clock", "decision": "keep"}
{"case_id": "2", "solve_success": true, "attempts": 2}
{"iteration": 1, "case_id": "18", "analysis": {"root_cause": "The agent correctly identified the time as 7:10 from the fixed image but performed the addition incorrectly (7:10 + 9:35 = 16:45, not 4:45).", "next_action": "generate_skill"}, "tool_generated": null, "skill_generated": "mirror_clock", "decision": "discard"}
{"iteration": 2, "case_id": "18", "analysis": {"root_cause": "The agent consistently misreads the clock time from the corrected image, identifying it as 7:10 instead of 4:10.", "next_action": "generate_skill"}, "tool_generated": null, "skill_generated": "mirror_clock", "decision": "discard"}
{"iteration": 3, "case_id": "18", "analysis": {"root_cause": "The agent consistently misreads the clock face in the corrected image (reading 7:10 instead of 4:10) and fails to perform the time addition correctly.", "next_action": "generate_skill"}, "tool_generated": null, "skill_generated": "mirror_clock", "decision": "discard"}
