{"type": "promotion", "cap_type": "tool", "name": "mirror_flip", "decision": "keep", "timestamp": "2026-03-15T03:41:18.466054"}
{"type": "promotion", "cap_type": "skill", "name": "mirror_clock", "decision": "keep", "timestamp": "2026-03-15T03:41:18.466747"}
{"iteration": 1, "case_id": "2", "analysis": {"root_cause": "The agent failed to perform the horizontal flip transformation required to read the mirrored clock face correctly before calculating the time.", "next_action": "generate_tool"}, "tool_generated": "mirror_flip", "skill_generated": "mirror_clock", "decision": "keep"}
{"case_id": "2", "solve_success": true, "attempts": 1}
{"iteration": 1, "case_id": "18", "analysis": {"root_cause": "The agent failed to account for the 180-degree rotation of the clock face in addition to the horizontal mirror reflection.", "next_action": "generate_tool"}, "tool_generated": "rotate_and_flip_clock", "skill_generated": "mirror_clock", "decision": "discard"}
{"iteration": 2, "case_id": "18", "analysis": {"root_cause": "The agent fails to correctly read the time from the transformed image (Artifact 1 shows 7:10, but the agent misinterprets it).", "next_action": "generate_skill"}, "tool_generated": null, "skill_generated": "mirror_clock", "decision": "discard"}
{"iteration": 3, "case_id": "18", "analysis": {"root_cause": "The tool only performed a horizontal flip, failing to account for the vertical inversion (upside-down state) of the clock face.", "next_action": "generate_tool"}, "tool_generated": "rotate_180_degrees", "skill_generated": "mirror_clock", "decision": "discard"}
