{"iteration": 1, "case_id": "2", "analysis": {"root_cause": "The agent failed to perform the horizontal flip required to interpret the mirror image correctly and did not perform the time calculation.", "next_action": "generate_both"}, "tool_generated": "mirror_flip", "skill_generated": "mirror_clock", "decision": "discard"}
{"iteration": 2, "case_id": "2", "analysis": {"root_cause": "The agent failed to correctly interpret the mirrored clock face and perform the subsequent arithmetic, likely due to confusion between mirror-image reading and standard clock reading.", "next_action": "generate_both"}, "tool_generated": "mirror_flip", "skill_generated": "mirror_clock", "decision": "discard"}
{"type": "promotion", "cap_type": "tool", "name": "mirror_flip", "decision": "keep", "timestamp": "2026-03-15T02:39:21.101250"}
{"type": "promotion", "cap_type": "skill", "name": "mirror_clock", "decision": "keep", "timestamp": "2026-03-15T02:39:21.101666"}
{"iteration": 3, "case_id": "2", "analysis": {"root_cause": "The agent consistently misinterprets the mirrored clock face, failing to correctly map the mirrored hand positions to standard clock coordinates.", "next_action": "generate_both"}, "tool_generated": "mirror_flip", "skill_generated": "mirror_clock", "decision": "keep"}
{"case_id": "2", "solve_success": true, "attempts": 3}
{"iteration": 1, "case_id": "18", "analysis": {"root_cause": "The agent correctly flipped the image but misread the time from the flipped clock (it read 7:10 instead of 4:10) and performed incorrect arithmetic.", "next_action": "generate_skill"}, "tool_generated": null, "skill_generated": "mirror_clock", "decision": "discard"}
{"iteration": 2, "case_id": "18", "analysis": {"root_cause": "The agent correctly flipped the image to 4:10, but misread the time as 7:10 and performed incorrect arithmetic.", "next_action": "generate_skill"}, "tool_generated": null, "skill_generated": "mirror_clock", "decision": "discard"}
{"iteration": 3, "case_id": "18", "analysis": {"root_cause": "The agent incorrectly read the mirror-flipped clock. The hour hand is between 4 and 5 (closer to 4), and the minute hand is at 10, making the time 4:10, not 7:10.", "next_action": "generate_skill"}, "tool_generated": null, "skill_generated": "mirror_clock", "decision": "discard"}
