{"iteration": 1, "case_id": "2", "analysis": {"root_cause": "The agent failed to perform the horizontal reflection (mirroring) required to interpret the clock face correctly before calculating the time offset.", "next_action": "generate_both"}, "tool_generated": "mirror_clock_fixer", "skill_generated": "mirror_clock", "decision": "discard"}
{"type": "promotion", "cap_type": "tool", "name": "mirror_flip", "decision": "keep", "timestamp": "2026-03-15T02:59:46.477369"}
{"type": "promotion", "cap_type": "skill", "name": "mirror_clock", "decision": "keep", "timestamp": "2026-03-15T02:59:46.477761"}
{"iteration": 2, "case_id": "2", "analysis": {"root_cause": "The agent failed to correctly interpret the mirrored clock face and perform the time arithmetic, likely due to confusion between the mirrored positions and standard clock reading.", "next_action": "generate_both"}, "tool_generated": "mirror_flip", "skill_generated": "mirror_clock", "decision": "keep"}
{"case_id": "2", "solve_success": true, "attempts": 2}
{"iteration": 1, "case_id": "18", "analysis": {"root_cause": "The agent correctly flipped the image but misread the time on the corrected clock (read 7:10 instead of 4:10) and failed the subsequent arithmetic.", "next_action": "generate_both"}, "tool_generated": "clock_mirror_corrector", "skill_generated": "mirror_clock", "decision": "discard"}
{"iteration": 2, "case_id": "18", "analysis": {"root_cause": "The agent misread the mirror-flipped clock face. In the flipped image, the hour hand is between 4 and 5 (closer to 4) and the minute hand is at 2, indicating 4:10, not 7:10.", "next_action": "generate_skill"}, "tool_generated": null, "skill_generated": "mirror_clock", "decision": "discard"}
{"iteration": 3, "case_id": "18", "analysis": {"root_cause": "The agent consistently misreads the mirror-flipped clock face (4:10) as 7:10, leading to incorrect calculations.", "next_action": "generate_skill"}, "tool_generated": null, "skill_generated": "mirror_clock", "decision": "discard"}
