{"iteration": 1, "case_id": "2", "analysis": {"root_cause": "The agent failed to perform the horizontal reflection (mirroring) required to interpret the clock face correctly before calculating the time.", "next_action": "generate_tool"}, "tool_generated": "mirror_flip", "skill_generated": "mirror_clock", "validation_input_image": "datasets/mira/mirror_clock/images/2.png", "validation_chain_trace": [], "decision": "discard"}
{"iteration": 2, "case_id": "2", "analysis": {"root_cause": "The agent failed to correctly interpret the time from the corrected clock face (Artifact 2) and perform the simple arithmetic addition of 8 hours and 10 minutes.", "next_action": "generate_skill"}, "tool_generated": null, "skill_generated": "mirror_clock", "validation_input_image": null, "validation_chain_trace": [], "decision": "discard"}
{"type": "promotion", "cap_type": "tool", "name": "mirror_flip", "decision": "keep", "timestamp": "2026-03-15T05:47:36.014618"}
{"type": "promotion", "cap_type": "skill", "name": "mirror_clock", "decision": "keep", "timestamp": "2026-03-15T05:47:36.015599"}
{"iteration": 3, "case_id": "2", "analysis": {"root_cause": "The agent failed to correctly interpret the mirrored clock face and perform the subsequent time addition.", "next_action": "generate_both"}, "tool_generated": "mirror_flip", "skill_generated": "mirror_clock", "validation_input_image": "datasets/mira/mirror_clock/images/2.png", "validation_chain_trace": [], "decision": "keep"}
{"case_id": "2", "solve_success": true, "attempts": 3}
{"iteration": 1, "case_id": "18", "analysis": {"root_cause": "The agent correctly flipped the image but failed to accurately read the time from the corrected clock face (misinterpreting the hour hand position).", "next_action": "generate_skill"}, "tool_generated": null, "skill_generated": "mirror_clock", "validation_input_image": null, "validation_chain_trace": [], "decision": "discard"}
{"type": "promotion", "cap_type": "tool", "name": "rotate_clock", "decision": "keep", "timestamp": "2026-03-15T05:48:52.521620"}
{"type": "promotion", "cap_type": "skill", "name": "mirror_clock", "decision": "keep", "timestamp": "2026-03-15T05:48:52.521866"}
{"iteration": 2, "case_id": "18", "analysis": {"root_cause": "The agent correctly identified the time as 7:10 but failed the arithmetic: 7:10 + 9:35 = 16:45, which is 4:45, not 4:10 + 35 = 4:45. Wait, 7:10 + 9:35 is 16:45 (4:45). The agent's calculation 7:10 + 9h = 16:10, then 16:10 + 35m = 16:45 is correct, but it concluded 4:45, which is correct. The expected answer 1:40 suggests the clock reading 7:10 is wrong.", "next_action": "generate_both"}, "tool_generated": "rotate_clock", "skill_generated": "mirror_clock", "validation_input_image": "artifacts/case_18/attempt_2/chain_1_mirror_flip/mirror_flip_output.png", "validation_chain_trace": ["mirror_flip"], "decision": "keep"}
{"case_id": "18", "solve_success": true, "attempts": 2}
