{"type": "promotion", "cap_type": "tool", "name": "mirror_clock_flipper", "decision": "keep", "timestamp": "2026-03-15T02:20:41.824078"}
{"type": "promotion", "cap_type": "skill", "name": "mirror_clock", "decision": "keep", "timestamp": "2026-03-15T02:20:41.824943"}
{"iteration": 1, "case_id": "2", "analysis": {"root_cause": "The agent failed to perform the horizontal reflection required to interpret the mirror image of the clock and then failed to perform the temporal arithmetic.", "next_action": "generate_both"}, "tool_generated": "mirror_clock_flipper", "skill_generated": "mirror_clock", "decision": "keep"}
{"case_id": "2", "solve_success": true, "attempts": 1}
{"iteration": 1, "case_id": "18", "analysis": {"root_cause": "The agent failed to correctly read the time from the flipped clock image (it is 4:10, not 7:10) and subsequently performed incorrect arithmetic.", "next_action": "generate_skill"}, "tool_generated": null, "skill_generated": "mirror_clock", "decision": "discard"}
{"iteration": 2, "case_id": "18", "analysis": {"root_cause": "The agent incorrectly read the mirrored clock face. The hour hand is at 4 and the minute hand is at 10, meaning the time is 4:10, not 7:10.", "next_action": "generate_skill"}, "tool_generated": null, "skill_generated": "mirror_clock", "decision": "discard"}
{"iteration": 3, "case_id": "18", "analysis": {"root_cause": "The agent misread the mirrored clock face even after flipping it. In the flipped image, the hour hand is at 4 and the minute hand is at 10, meaning 4:50, not 7:10.", "next_action": "generate_skill"}, "tool_generated": null, "skill_generated": "mirror_clock", "decision": "discard"}
