{"iteration": 1, "case_id": "2", "analysis": {"root_cause": "The agent attempted to answer without performing a horizontal flip (mirroring) on the image to read the time correctly.", "next_action": "generate_both"}, "tool_generated": "mirror_image", "skill_generated": "mirror_clock", "validation_input_image": "datasets/mira/images/2.png", "validation_chain_trace": [], "decision": "discard"}
{"iteration": 2, "case_id": "2", "analysis": {"root_cause": "The agent failed to correctly interpret the time on the normalized clock face (7:10) and perform the addition (7:10 + 8:10 = 15:20, which is 3:20).", "next_action": "generate_skill"}, "tool_generated": null, "skill_generated": "mirror_clock", "validation_input_image": null, "validation_chain_trace": [], "decision": "discard"}
{"type": "promotion", "cap_type": "tool", "name": "mirror_fixer", "decision": "keep", "timestamp": "2026-03-15T04:41:43.954051"}
{"type": "promotion", "cap_type": "skill", "name": "mirror_clock", "decision": "keep", "timestamp": "2026-03-15T04:41:43.954740"}
{"iteration": 3, "case_id": "2", "analysis": {"root_cause": "The agent failed to correctly interpret the mirrored clock face and perform the time calculation, likely due to difficulty reading reversed numbers and hands simultaneously.", "next_action": "generate_both"}, "tool_generated": "mirror_fixer", "skill_generated": "mirror_clock", "validation_input_image": "datasets/mira/images/2.png", "validation_chain_trace": [], "decision": "keep"}
{"case_id": "2", "solve_success": true, "attempts": 3}
{"type": "promotion", "cap_type": "tool", "name": "rotation_fixer", "decision": "keep", "timestamp": "2026-03-15T04:42:17.521119"}
{"type": "promotion", "cap_type": "skill", "name": "mirror_clock", "decision": "keep", "timestamp": "2026-03-15T04:42:17.521385"}
{"iteration": 1, "case_id": "18", "analysis": {"root_cause": "The agent misread the time from the upside-down artifact (7:10 instead of 4:50), leading to an incorrect calculation.", "next_action": "generate_both"}, "tool_generated": "rotation_fixer", "skill_generated": "mirror_clock", "validation_input_image": "artifacts/case_18/attempt_1/chain_1_mirror_fixer/mirror_fixer_output.png", "validation_chain_trace": ["mirror_fixer"], "decision": "keep"}
{"case_id": "18", "solve_success": true, "attempts": 1}
