{"type": "promotion", "cap_type": "tool", "name": "billiards_path_tracer", "decision": "keep", "timestamp": "2026-03-15T19:30:22.776975"}
{"type": "promotion", "cap_type": "skill", "name": "billiards", "decision": "keep", "timestamp": "2026-03-15T19:30:22.777627"}
{"iteration": 1, "case_id": "2", "analysis": {"root_cause": "The agent failed to perform the geometric projection of the ball's trajectory, which requires calculating reflections off the rails.", "next_action": "generate_tool"}, "tool_generated": "billiards_path_tracer", "skill_generated": "billiards", "validation_input_image": "datasets/mira/billiards/images/2.png", "validation_chain_trace": [], "decision": "keep"}
{"case_id": "2", "solve_success": true, "attempts": 1}
{"iteration": 1, "case_id": "11", "analysis": {"root_cause": "The existing path-tracing tool is generic and fails to calculate the specific reflection path for the given arrow angle, leading to an incorrect prediction.", "next_action": "generate_tool"}, "tool_generated": "billiards_path_tracer", "skill_generated": null, "validation_input_image": "", "validation_chain_trace": [], "decision": "discard"}
{"iteration": 2, "case_id": "11", "analysis": {"root_cause": "The previous tool failed to implement a physics-based path tracer, instead overlaying a generic grid that does not represent the actual trajectory.", "next_action": "generate_tool"}, "tool_generated": "billiards_path_tracer", "skill_generated": null, "validation_input_image": "", "validation_chain_trace": [], "decision": "discard"}
{"iteration": 3, "case_id": "11", "analysis": {"root_cause": "The agent attempted to call a non-existent tool 'billiards_path_tracer' instead of performing the geometric calculation or using a valid tool.", "next_action": "generate_tool"}, "tool_generated": "billiards_path_tracer", "skill_generated": null, "validation_input_image": "", "validation_chain_trace": [], "decision": "discard"}
{"type": "promotion", "cap_type": "failure_skill", "name": "billiards:case_11", "decision": "keep", "timestamp": "2026-03-15T19:32:48.459736"}
